{"adapters":{"swe_multilang":{"argv":["/opt/pneuma/benchmark-adapters/swe-live/adapter"],"executable_relative_path":"benchmark-adapters/swe-live/adapter","source_repository":"microsoft/SWE-bench-Live","source_revision":"70ec57e852e3f2d195790fe71f553e272c691833","source_snapshot_sha256":"9fa6e45d00eb8c93d9a6b13804920ce3356194009ccc8beb5db9b22263a0c0be"},"tau2":{"argv":["/opt/pneuma/benchmark-adapters/tau2/adapter"],"executable_relative_path":"benchmark-adapters/tau2/adapter","source_repository":"sierra-research/tau2-bench","source_revision":"fc0055dc4e0a316c3f83133267fbd6faaa770992","source_snapshot_sha256":"2f9df2eedc845df1745cafa860a1b62c88223e7aa114167088c40380242a24b5"}},"record_kind":"cloud_registered_benchmark_adapter_manifest","schema_version":"0.1.0","status":"prelaunch_source_binding"}
